Player_ID,Content,Created_Time,Up_vote_Count,Down_vote_Count,Post_ID,User_ID,Comments_Count,Content_Title
boston,Odd question: what are some worthwhile guided tours/activities a friend and I can do on horseback on our US roadtrip? (Details inside),2019-04-23 23:36:05,1,0,bgpunk,02012017,1,Odd question: what are some worthwhile guided tours/activities a friend and I can do on horseback on our US roadtrip? (Details inside)
boston,Looking for inspiration for a trip Dec. 25-30,2019-04-22 19:38:29,4,0,bg94k0,jclinares,11,Looking for inspiration for a trip Dec. 25-30
boston,Opinions wanted on north east US road trip itinerary.,2019-04-22 14:33:28,3,0,bg5li1,Twatz_McKenzey,14,Opinions wanted on north east US road trip itinerary.
boston,"12 Days, Scandinavia in June - Help! :) Visiting from Boston. Do you think this itinerary is do-able? What would you add/remove? Thanks!",2019-04-21 17:19:41,3,0,bfts1w,bostonflyfish,4,"12 Days, Scandinavia in June - Help! :) Visiting from Boston. Do you think this itinerary is do-able? What would you add/remove? Thanks!"
boston,Headed to Toronto,2019-04-20 22:32:59,3,0,bfk7en,ripcity32,14,Headed to Toronto
boston,Traveling solo to Iceland in the summer. I need your suggestions!,2019-04-17 11:52:47,1,0,be9f4g,bestbout,17,Traveling solo to Iceland in the summer. I need your suggestions!
newyorkcity,Hidden Gems in New York City and Surrounding Areas?,2019-04-24 17:50:13,3,0,bh0ibs,StarmieUsePsychic,6,Hidden Gems in New York City and Surrounding Areas?
newyorkcity,Visiting Hong Kong and Shenzhen; visa on arrival in China,2019-04-22 03:09:06,2,0,bfz3yn,john-bkk,7,Visiting Hong Kong and Shenzhen; visa on arrival in China
miami,"Help, passport was accidentally thrown away, flying out of country in six days.",2019-04-23 11:37:28,1,0,bght7c,imdanwyatt,15,"Help, passport was accidentally thrown away, flying out of country in six days."
miami,Miami Recommendations,2019-04-22 16:49:09,1,0,bg77b9,jtidesmith13,6,Miami Recommendations
miami,Website that finds cheapest flights for two people to meet? Or other advice to find this cheapest flights for meet up.,2019-04-20 19:09:35,5,0,bfib9w,michaelbrules,5,Website that finds cheapest flights for two people to meet? Or other advice to find this cheapest flights for meet up.
miami,Funds needed for 2 months travelling around the USA,2019-04-19 13:19:00,5,0,bf1q01,toothjones,8,Funds needed for 2 months travelling around the USA
miami,"New Traveler Here, Quick Questions",2019-04-15 13:51:00,1,0,bdj29w,AccFire99,6,"New Traveler Here, Quick Questions"
miami,Virginia Beach Vs. Miami Beach,2019-04-14 00:11:59,1,0,bcz391,NowUsernameIsMyName,6,Virginia Beach Vs. Miami Beach
chicago,Shortened first name on international ticket. Is there anything that can be done?,2019-04-25 13:52:52,0,0,bhbnrc,dumb_first_name,21,Shortened first name on international ticket. Is there anything that can be done?
chicago,1.5 Hour Layover in Chicago OHare Long Enough (No Train)? +Presenting Credit Card,2019-04-24 18:01:32,1,0,bh0mrm,jakegiratin,15,1.5 Hour Layover in Chicago OHare Long Enough (No Train)? +Presenting Credit Card
chicago,Epic trip idea?,2019-04-22 23:13:18,2,0,bgbbkm,nagemnol,14,Epic trip idea?
chicago,Should I put my camera in my checked or carry on?,2019-04-22 13:13:34,1,0,bg4n88,iamkwang,7,Should I put my camera in my checked or carry on?
chicago,Hiking in central/southern US,2019-04-22 08:09:10,1,0,bg1c5f,InsanelyAppropriate,7,Hiking in central/southern US
chicago,Traveling the US by train,2019-04-20 22:10:56,9,0,bfk09i,BeyondTheGazebo,17,Traveling the US by train
chicago,"Looking for Romantic Midwest Vacation Ideas, Picky Travelers",2019-04-20 09:34:43,2,0,bfc8jw,oboer-331,12,"Looking for Romantic Midwest Vacation Ideas, Picky Travelers"
chicago,How hot is Houston for someone who spent his whole life in cold Chicago?,2019-04-15 01:14:14,1,0,bdcb6w,I_Fet_Fet_Yaps,3,How hot is Houston for someone who spent his whole life in cold Chicago?
losangeles,Help: West Coast USA - 2nd Half May - 15 days travel,2019-04-25 15:47:19,1,0,bhcz7c,DhirajKamble,3,Help: West Coast USA - 2nd Half May - 15 days travel
losangeles,what’s the best city to travel to in California?,2019-04-22 13:45:10,2,0,bg50vg,savingsav,20,what’s the best city to travel to in California?
losangeles,Traveling Minors and Hotels,2019-04-22 00:12:21,1,0,bfxsys,alilrecalcitrant,3,Traveling Minors and Hotels
losangeles,Help deciding on Western USA road trip,2019-04-21 13:38:58,1,0,bfrdj5,WestSlice,8,Help deciding on Western USA road trip
losangeles,Question regarding the US/Mexico crossing,2019-04-19 08:59:38,1,0,beytc1,neutraditionalist,11,Question regarding the US/Mexico crossing
losangeles,Virgin Atlantic flight is half the price through Air France? Legit?,2019-04-17 12:45:28,2,0,bea1ep,TransangelicExodus,24,Virgin Atlantic flight is half the price through Air France? Legit?
losangeles,What minivan is the best to rent?,2019-04-17 10:13:47,2,0,be8an2,sandals456,5,What minivan is the best to rent?
losangeles,"In the very early stages of formulating an European itinerary, looking for some input",2019-04-17 01:35:40,2,0,be4637,jaynepierce,4,"In the very early stages of formulating an European itinerary, looking for some input"
losangeles,Possible Bro trip to Los Angeles for E3. Seeking advice,2019-04-15 22:48:43,0,0,bdou78,CookWanLyrnYhrd,2,Possible Bro trip to Los Angeles for E3. Seeking advice
lasvegas,Help me plan my drive through Yosemite,2019-04-22 11:41:01,3,0,bg3jw0,milhouse21386,6,Help me plan my drive through Yosemite
lasvegas,Las Vegas and Grand Canyon,2019-04-21 19:33:35,1,0,bfv5pb,AuxilliaryCable,8,Las Vegas and Grand Canyon
lasvegas,Norwegian no longer doing flights London -> Vegas?,2019-04-21 08:57:36,1,0,bfoj82,rl123456,17,Norwegian no longer doing flights London -> Vegas?
lasvegas,Wifi in the USA,2019-04-17 05:22:33,0,0,be5pcl,fluffypuffyz,16,Wifi in the USA
lasvegas,Finding a hotel room in Las Vegas with a jacuzzi in the room?,2019-04-14 01:38:53,2,0,bczphq,Myardraug,4,Finding a hotel room in Las Vegas with a jacuzzi in the room?
lasvegas,Give me feedback on California to New York road trip itinerary,2019-04-12 06:45:05,5,0,bcc2we,Nellie1889,7,Give me feedback on California to New York road trip itinerary
denver,Sleeping in the Denver Airport,2019-04-21 17:51:36,0,0,bfu45w,tesla33,14,Sleeping in the Denver Airport
philadelphia,Need help finding a place to road trip to in the North-East of The United States!,2019-04-20 09:16:50,4,0,bfc2v8,jsszi101,13,Need help finding a place to road trip to in the North-East of The United States!
seattle,"Travel suggestions for September: warm, sunny, beaches, hiking",2019-04-23 18:27:43,1,0,bgmn68,thelittlegnome,13,"Travel suggestions for September: warm, sunny, beaches, hiking"
seattle,Couple Needs Vacation/ Adventure Ideas and Tips,2019-04-22 15:57:48,0,0,bg6lfs,CHowie1072,13,Couple Needs Vacation/ Adventure Ideas and Tips
seattle,Looking to take a multi-city domestic trip in July. Is there any hidden/extra cost to book each ticket separately?,2019-04-17 11:09:44,0,0,be8x0j,Zarski843,6,Looking to take a multi-city domestic trip in July. Is there any hidden/extra cost to book each ticket separately?
seattle,"Traveling to Seattle, then Vancouver, then Banff in June. Confused on rental cars...",2019-04-16 08:42:44,1,0,bdthfs,melalovelady,12,"Traveling to Seattle, then Vancouver, then Banff in June. Confused on rental cars..."
seattle,2 Week Trip to Seattle and Portland,2019-04-15 18:57:16,3,0,bdmir8,Steveo3k1222,5,2 Week Trip to Seattle and Portland
seattle,Regular fare for ATL -> SEA roundtrip?,2019-04-13 18:29:44,0,0,bcw3ni,cookiepukie,15,Regular fare for ATL -> SEA roundtrip?
neworleans,Long weekend trip ideas within a 4-hour plane ride from Northern California?,2019-04-24 13:15:07,2,0,bgx9w8,articulady,5,Long weekend trip ideas within a 4-hour plane ride from Northern California?
neworleans,Planning an artsy two-week trip in September- where to go?,2019-04-19 15:09:09,5,0,bf308d,ifflejink,12,Planning an artsy two-week trip in September- where to go?
neworleans,"Planning to take a trip to New Orleans, LA and want tips/advice!",2019-04-17 14:41:37,1,0,bebeak,brina96,11,"Planning to take a trip to New Orleans, LA and want tips/advice!"
sedona,"US Destinations Similar to Jackson Hole, WY",2019-04-24 14:53:48,3,0,bgyg4w,TheLoosestJuice,16,"US Destinations Similar to Jackson Hole, WY"
sedona,Loved camping out in Sedona Arizona! Made me feel like I was traveling back to a simpler time!,2019-04-14 17:29:45,24,0,bd7v1f,Creative-Trojan-,1,Loved camping out in Sedona Arizona! Made me feel like I was traveling back to a simpler time!
portland,can i take a marijuana edible on an international flight?,2019-04-18 02:56:32,0,0,beii66,lukemh666,20,can i take a marijuana edible on an international flight?
austin,Should I just go home? I need advice.,2019-04-23 02:42:54,12,0,bgd5kq,Inthaihospital,28,Should I just go home? I need advice.
austin,[Question] My family is coming to visit USA. I need your suggestions,2019-04-17 11:16:47,2,0,be8zxl,shaggypeach,8,[Question] My family is coming to visit USA. I need your suggestions
austin,"Driving to Colorado for 2 days through new Mexico from Austin texas, what is there to do?",2019-04-16 14:21:36,2,0,bdxafs,Zaxon3,8,"Driving to Colorado for 2 days through new Mexico from Austin texas, what is there to do?"
austin,Going from Austin --> LA in 6 days; looking to hit national parks in late May/early June. Suggestions?,2019-04-12 23:29:54,0,0,bcmgty,btaylor9,6,Going from Austin --> LA in 6 days; looking to hit national parks in late May/early June. Suggestions?
